{"changes":[{"after":"I4","before":"U4","category":"INTERFACE_CHANGE","change_id":"SV_DATA_TYPE_CHANGED","field":"data_type","relationship_delta":null,"scope":"property","subject":{"entity_type":"status_variable","source_a":{"implementation_id":"44","key":"sv","name":null,"wkn":null},"source_b":{"implementation_id":"44","key":"sv","name":null,"wkn":null}}},{"after":"Revised note","before":"Old note","category":"DOCUMENTATION_CHANGE","change_id":"SV_DESCRIPTION_CHANGED","field":"description","relationship_delta":null,"scope":"property","subject":{"entity_type":"status_variable","source_a":{"implementation_id":"44","key":"sv","name":null,"wkn":null},"source_b":{"implementation_id":"44","key":"sv","name":null,"wkn":null}}}],"dependency_context":[{"source_a":{"dependencies":[{"entity_key":"dr","entity_type":"default_report","evidence":[{"edges":[{"owner_key":"dr","reference":{"canonical_type":"entity_reference","implementation_id":"44","metadata":{},"name":null,"provenance":[],"scope_key":null,"target_key":"sv","target_types":["status_variable"],"unknown_extensions":[],"wkn":null},"role":"variables[0]","target_key":"sv"}]}],"implementation_id":"7","kind":"REFERENCED_BY","name":null}],"excluded_unresolved_graph_relationships":0,"statements":["Referenced by 1 default report."],"subject_key":"sv","subject_type":"status_variable"},"source_b":{"dependencies":[{"entity_key":"dr","entity_type":"default_report","evidence":[{"edges":[{"owner_key":"dr","reference":{"canonical_type":"entity_reference","implementation_id":"44","metadata":{},"name":null,"provenance":[],"scope_key":null,"target_key":"sv","target_types":["status_variable"],"unknown_extensions":[],"wkn":null},"role":"variables[0]","target_key":"sv"}]}],"implementation_id":"7","kind":"REFERENCED_BY","name":null}],"excluded_unresolved_graph_relationships":0,"statements":["Referenced by 1 default report."],"subject_key":"sv","subject_type":"status_variable"},"subject":{"entity_type":"status_variable","source_a":{"implementation_id":"44","key":"sv","name":null,"wkn":null},"source_b":{"implementation_id":"44","key":"sv","name":null,"wkn":null}}}],"diagnostics":[{"code":"FIXTURE_NOTE","entity_context":null,"message":"Synthetic example","provenance":null,"severity":"INFO","source":"a","source_line":null,"source_path":"before.xml"}],"matches":[{"confidence":"EXACT_IDENTITY","evidence":[{"entity_type":"default_report","identity":["7"],"source_a_keys":["dr"],"source_b_keys":["dr"],"strategy":"NATIVE_ID"}],"strategy":"NATIVE_ID","subject":{"entity_type":"default_report","source_a":{"implementation_id":"7","key":"dr","name":null,"wkn":null},"source_b":{"implementation_id":"7","key":"dr","name":null,"wkn":null}}},{"confidence":"EXACT_IDENTITY","evidence":[{"entity_type":"status_variable","identity":["44"],"source_a_keys":["sv"],"source_b_keys":["sv"],"strategy":"NATIVE_ID"}],"strategy":"NATIVE_ID","subject":{"entity_type":"status_variable","source_a":{"implementation_id":"44","key":"sv","name":null,"wkn":null},"source_b":{"implementation_id":"44","key":"sv","name":null,"wkn":null}}}],"report_schema_version":"2.0","source_a":{"path":"before.xml","revision":"E172-0225"},"source_b":{"path":"after.xml","revision":"E172-0225"},"summary":{"added":0,"changed_entities":1,"changes":2,"diagnostics":1,"documentation_changes":1,"interface_changes":1,"is_complete":true,"matched":2,"removed":0,"unknown_changes":0,"unresolved":0},"tool_version":"0.1.0","unresolved":[]}
