{"changes":[],"dependency_context":[],"diagnostics":[],"matches":[],"report_schema_version":"2.0","source_a":{"path":"before.xml","revision":"E172-0225"},"source_b":{"path":"after.xml","revision":"E172-0225"},"summary":{"added":0,"changed_entities":0,"changes":0,"diagnostics":0,"documentation_changes":0,"interface_changes":0,"is_complete":false,"matched":0,"removed":0,"unknown_changes":0,"unresolved":4},"tool_version":"0.1.0","unresolved":[{"detail":"IDENTITY_COLLISION","entity_key":"a1","entity_type":"supported_message","field":null,"identity_ambiguity":{"evidence":[{"entity_type":"supported_message","identity":["1","13"],"source_a_keys":["a1","a2"],"source_b_keys":["b1","b2"],"strategy":"STREAM_FUNCTION"}],"reasons":["IDENTITY_COLLISION"],"source_a_keys":["a1","a2"],"source_b_keys":["b1","b2"]},"issue_code":"AMBIGUOUS_IDENTITY","source":"a"},{"detail":"IDENTITY_COLLISION","entity_key":"a2","entity_type":"supported_message","field":null,"identity_ambiguity":{"evidence":[{"entity_type":"supported_message","identity":["1","13"],"source_a_keys":["a1","a2"],"source_b_keys":["b1","b2"],"strategy":"STREAM_FUNCTION"}],"reasons":["IDENTITY_COLLISION"],"source_a_keys":["a1","a2"],"source_b_keys":["b1","b2"]},"issue_code":"AMBIGUOUS_IDENTITY","source":"a"},{"detail":"IDENTITY_COLLISION","entity_key":"b1","entity_type":"supported_message","field":null,"identity_ambiguity":{"evidence":[{"entity_type":"supported_message","identity":["1","13"],"source_a_keys":["a1","a2"],"source_b_keys":["b1","b2"],"strategy":"STREAM_FUNCTION"}],"reasons":["IDENTITY_COLLISION"],"source_a_keys":["a1","a2"],"source_b_keys":["b1","b2"]},"issue_code":"AMBIGUOUS_IDENTITY","source":"b"},{"detail":"IDENTITY_COLLISION","entity_key":"b2","entity_type":"supported_message","field":null,"identity_ambiguity":{"evidence":[{"entity_type":"supported_message","identity":["1","13"],"source_a_keys":["a1","a2"],"source_b_keys":["b1","b2"],"strategy":"STREAM_FUNCTION"}],"reasons":["IDENTITY_COLLISION"],"source_a_keys":["a1","a2"],"source_b_keys":["b1","b2"]},"issue_code":"AMBIGUOUS_IDENTITY","source":"b"}]}
